{
  "id": "mina",
  "version": 1,
  "names": {
    "autonym": "mina",
    "ja": "ミーナ語",
    "en": "Mina"
  },
  "description": "新規の架空言語を設計するための雛形。CV 音節、膠着、主題助詞 ya、疑問 ka。アーヴ語と同じ 7 格役割で日本語・英語と橋渡しする。",
  "script": "latin",
  "lexicon": "lexicon.json",
  "closed_forms": ["ya", "ka", "o"],
  "grammar_notes": [
    "語順は SOV。修飾は被修飾の前。",
    "主題は nominative + ya（代名詞の縮約はしない）。",
    "「AはBだ」は A ya + B の具格。コピュラ sulu は省略する。",
    "疑問は文末に ka。呼びかけは nominative + o。",
    "未登録の普通名詞は造語せず原文のまま残す。"
  ],
  "phonology": {
    "engine": "table",
    "syllable": "(C)V(n)",
    "vowels": ["a", "e", "i", "o", "u"],
    "consonants": ["p", "t", "k", "m", "n", "s", "l", "r", "h", "d", "y"],
    "silent_final": [],
    "digraphs": {},
    "ipa": {
      "a": "a",
      "e": "e",
      "i": "i",
      "o": "o",
      "u": "u",
      "p": "p",
      "t": "t",
      "k": "k",
      "m": "m",
      "n": "n",
      "s": "s",
      "l": "l",
      "r": "ɾ",
      "h": "h",
      "d": "d",
      "y": "j"
    },
    "reading_ja": {
      "vowels": {
        "a": "ア",
        "i": "イ",
        "u": "ウ",
        "e": "エ",
        "o": "オ"
      },
      "cv": {
        "p": "パピプペポ",
        "t": "タチツテト",
        "k": "カキクケコ",
        "m": "マミムメモ",
        "n": "ナニヌネノ",
        "s": "サシスセソ",
        "l": "ラリルレロ",
        "r": "ラリルレロ",
        "h": "ハヒフヘホ",
        "d": "ダヂヅデド",
        "y": "ヤイユエヨ"
      },
      "coda": {
        "n": "ン"
      }
    }
  },
  "morphology": {
    "engine": "suffix",
    "cases": ["nom", "acc", "gen", "dat", "all", "abl", "ins"],
    "case_ja": {
      "nom": "主格",
      "acc": "対格",
      "gen": "生格",
      "dat": "与格",
      "all": "向格",
      "abl": "奪格",
      "ins": "具格"
    },
    "case_particle_ja": {
      "nom": "が",
      "acc": "を",
      "gen": "の",
      "dat": "に",
      "all": "へ",
      "abl": "から",
      "ins": "で"
    },
    "default_noun": "a",
    "declensions": {
      "a": {
        "stem": { "drop_suffix": "a" },
        "suffixes": {
          "nom": "a",
          "acc": "o",
          "gen": "e",
          "dat": "i",
          "all": "an",
          "abl": "un",
          "ins": "de"
        }
      }
    },
    "voices": ["causative", "passive", "negative"],
    "voice_suffix": {
      "causative": "as",
      "passive": "ar",
      "negative": "na"
    },
    "moods": ["indicative", "subjunctive", "imperative", "participle"],
    "aspects": ["indefinite", "perfect", "progressive", "prospective"],
    "verb_endings": {
      "indicative|indefinite": "u",
      "indicative|perfect": "ta",
      "indicative|progressive": "te",
      "indicative|prospective": "ro",
      "subjunctive|indefinite": "eba",
      "imperative|indefinite": "e",
      "participle|indefinite": "a"
    },
    "default_verb": "v"
  },
  "syntax": {
    "word_order": "SOV",
    "constituent_order": ["topic", "nom", "acc", "dat", "all", "abl", "ins", "verb"],
    "modifier_position": "before",
    "topic": {
      "particle": "ya",
      "position": "after",
      "form": "nom",
      "pronoun_contract": {}
    },
    "vocative": {
      "particle": "o",
      "position": "after",
      "form": "nom"
    },
    "question": {
      "particle": "ka",
      "position": "final"
    },
    "copula": {
      "lemma": "sul",
      "omit_with_ins": true
    },
    "period": ".",
    "question_mark": "?"
  }
}
